{
  "animation": "settled",
  "colorSpace": "srgb",
  "crop": [
    0,
    0,
    100,
    100
  ],
  "direction": "ltr",
  "fontHashes": {},
  "insets": [
    0,
    0,
    0,
    0
  ],
  "locale": "en-US",
  "logicalSize": [
    100,
    100
  ],
  "nodeId": "synthetic:screen:review",
  "pixelSize": [
    100,
    100
  ],
  "platform": "synthetic",
  "renderer": "pillow",
  "scale": 1,
  "schemaVersion": 1,
  "sourceRevision": "synthetic-v1",
  "textScale": 1,
  "theme": "light"
}
